sha,message,html_url,repository_id,repository_full_name,repository_private,repository_fork
70a1d50e886518925b8bc05f36752a2db8c0d25e,"Chrimc/form (#394)//* Intermediate check-in before inverting//template/prop loops.////* Working generator with incomplete templates.////* Basic .lu files working.////* Update to generate single .lu file.////* Fix cli issues.////* Fix CLI issues with template resources.////* Clean up lint warnings.////* Fix lint errors.////* Generate composite .lu////* Add dialog and multi-language support.////* shortcut to debug////* Add per-locale .lg file.////* Update debug config to use temp directory.//Generate multilingual .lg file.////* Update to include schema prefix on names.////* Fix bugs in .lg genertion.////* try help////* help and cancel////* Copy schema to output directory.////* help and cancel version 1////* separate help.lu////* several fixes////* remove help enum////* reset launch.json////* remove empty line////* Add the ability to copy library dialog files.////* Add ability to specify schema and multiple//templates.////* Rename resources.//Support multiple templates.//Add *PROPN** pattern.////* Fix bug in striingify call.////* Generate schema.main.dialog and update config.////* Update templates to newest format.////* Update templates to match names.////* add .dialogs for several basic rules////* Update templates to use $ and add begindialog as a hack to work around ada//ptive issue.////* add .dialogs for several basic rules////* fix comments////* merge from origin////* small changes////* Add formCopy cmd file.////* Adjust for bug in templates.////* fix path////* Version 1 of contact.form.dialog////* Same info is modeled for both Home and Work.//* List of state abbreviations and their spelled-out names are specified in the separate state.en-us.lu, and used in the $mappings specifications.//* Latitude and Longitude should be auto-filled if the corresponding address are filled.//* Validation patterns are specified for zip codes and phone numbers.////* Fixed contact.form.dialog and added activity.form.dialog////* contact.form.dialog//  - Fixed spelling//  - Use phonenumber prebuilt entity type//* activity.form.dialog: the second scenario from Darren ""An employee working for a customer wants to add a quick update to a customer record after a call. This update will then be available for other people working with that customer to see"".////* Added opportunity.form.dialog////For Darren's scenario ""An employee working with a customer has had a meeting and needs to create a new opportunity.""////* change names////* Revert ""change names""////This reverts commit 64ffaff4559cd4f5b10e39eb611b5b258e9ba8ea.////* change names////* basic work done for ask, set and help////* cancel confirmation////* cancel confirmation done, unexpected property set confirmation in progress////* improve unexpected property test////* Version 1 of contact.form.dialog////* Same info is modeled for both Home and Work.//* List of state abbreviations and their spelled-out names are specified in the separate state.en-us.lu, and used in the $mappings specifications.//* Latitude and Longitude should be auto-filled if the corresponding address are filled.//* Validation patterns are specified for zip codes and phone numbers.////* Fixed contact.form.dialog and added activity.form.dialog////* contact.form.dialog//  - Fixed spelling//  - Use phonenumber prebuilt entity type//* activity.form.dialog: the second scenario from Darren ""An employee working for a customer wants to add a quick update to a customer record after a call. This update will then be available for other people working with that customer to see"".////* Added opportunity.form.dialog////For Darren's scenario ""An employee working with a customer has had a meeting and needs to create a new opportunity.""////* rename state.lu////* prebuilt lu templates////* remove choose entity////we only have chooseProperty and clarifyEntity////* Switch to event expected.////* Update templates for latest runtime and add ask for//multiple properties.////* Add **NAMES/**NAME** and generate property names.////* fix unexpected property confirmation usage////* change unexpected property action from ask to sendactivity////* all done confirmation////* Update names to support chooseProperty.////* Check-in bread value hack.////* Fix template bug around clarify.////* Update templates to use names and start numbers.////* complete the new forms////* contextual help////* activity schema working fine////* add meta info to opportunity schema////* opportunity semi-working////cannot use phonenumber;//properties not in required also got asked;//in stringset, default value is not expression, cannot get the value for @email////* three schemas working////sandwich, activity, opportunity////* contact schema working////Adding welcome message in beginDialog,//Add help message for non-enum properties,//All three CDS schemas working////* Sync changes for demo.////* Before adding mapping templates////* Getting close to E2e.////* Largely working with some template debugging.////* Update the readme.////* Update to latest expression and lg packages.//Support app schema.////* Update standard schema.////* Finish merge.////* Show metaschema.////* Fix readme typo.////* several changes (#299)////* several changes////(1) remove unused old files;//(2) change incorrect file names;//(3) add string ask templates;//(4) remove meta properties from schemas;//(5) fix an error in calculating optional properties////* fix help property bug////* Add string templates.////* a few changes (#318)////(1) fix the cancel.lu bug//(2) add datetime.lu//(2) stringSetdatetime.dialog.lg////* Add template for not understood.////* Connect to bf cli.////* Add basic role support.////* Nigao/newtemplate (#321)////* a few changes////(1) fix the cancel.lu bug//(2) add datetime.lu//(2) stringSetdatetime.dialog.lg////* autohelp for new templates////* Update to use @{} everywhere and remove auto-help//since it required post-ask action.////* Nigao/newtemplate (#323)////* a few changes////(1) fix the cancel.lu bug//(2) add datetime.lu//(2) stringSetdatetime.dialog.lg////* autohelp for new templates////* add $requires, and datetime entity sets////* add all stringSet for prebuilt entities explicitly////* change prebuilt-entity.lu.lg files////* Switch to using a triggerIntent instead of none for entities.//Cleanup filename expressions.////* Fix bug in status.////* Switch from dialog:form to dialog:generate////* Add top-level documentation.////* Update tests to use dialog:generate.////* Rename tests to generator.////* Fixing linting errors////* Generate confirmation card.////* Fix reference regex ot not match structured lg.////* Minor bug fixes.////* Update to allow multi-lingual fallback.////* Change from $type to $kind.//Change unionType to union.//Add documentation.////* Move from $type to $kind.////* Enable schema tests.////* Switch to $kind and add dynamic .schema.////* Update string to new help pattern.////* Merge with master and support $kind.////* Address review comments.",https://github.com/microsoft/botframework-cli/commit/70a1d50e886518925b8bc05f36752a2db8c0d25e,187076818,microsoft/botframework-cli,False,False
8b4d34080c99c70e8eee5f32032307b7c07e66b3,"Expand TestBot + Add tests (#1022)//* port over CoreBot dialogs into testBot//write unit tests for testbot using botbuilder-testing////* update package log////* update////* add testbot to package update stuff////* adjust package////* restore mybot url and class////* updates per comments////* add more tests////* add all tests for parity with c#////* test outcome of booking dialog////* new tests for dateresolver////* add spoken output to booking dialog////* remove unused paramter////* Update mainDialog constructor, add inputhint, replace dialog, airpot not found warning////* Fix unsupportedCities array length check////* Refactor luisHelper / FlightBookingRecognizer, update tests////* Update test////* Refactoring of MainDialog, flightBookingRecognizer and tests////* Add luis config check in mainDialog actStep function////* Renamed test files from tests.js to test.js to match naming pattern in botbuilder.//Renamed some test cases to use the same capitalization as bot builder.//Added empty .env file.//Added general .gitignore.//Added TSConfig////* Renamed test////* Updated instantiation of DialogTestClient to match the latest changes from master.//Removed unnecesary tests for creating DialogTestClient instance.//Renamed dialog variables as sut (systemt under test) to match the documentation.//Fixed some tests (need to fix others)////* Updated MainDialog to handle LUIS intents, show warnings for unsupported cities and work the same as the dotnet one.//Added helper methods to extract LUIS values for composite entities and datetime to FlightBookingRecognizer.//Added luis result json captures to testdata so we can write tests for entity extraction based on serialized results.//Updated BookingDialog to use proper text, speak and inputhints.//Updated DateResolverDialog to use proper text, speak and inputhints.//Removed onBeginDialog from cancelAndHelpDialog to avoid handling interruptions on turn 0.//Removed myBot.////* Formatting and comments in MaindDialog//Updated deployment template to point to messages instead of mybot.////* trying to fix the build by removing testbo from package.json////* reverted changes////* Updated bookingDialog logic and test data to match dotnet.////* updated tests to use testCases.map instead of for loop.//updated dateResolveDialog tests to use strictEquals.////* Touched file to kick off build.////* Changed flightBookingRecognizer so it caches the instance of the recognizer rather than creating one on each call.//Implemented 3 of for test scenarios for mainDialog (with mock dialogs and mock recognizer).//deleted unused mainDialogTestCases.//Updated other tests to use => instead of function().//Changed the oreder of constructor params for mainDialog.////* Implemented showWarningMessage tests for MainDialog.//Added placeholder for cancelAndHelpDialog.tests.////* Implemented CancelAndHelpDialog tests.////* Moved dialog tests into a dialogs folder.////* Implemented DialogAndWelcomeBot tests////* Added some comments to the code////* Updated comments.////* Updated confirm prompt to say ""is this correct""//Moved MockBookingDialogWithPrompt outside the test case for clarity.",https://github.com/microsoft/botbuilder-js/commit/8b4d34080c99c70e8eee5f32032307b7c07e66b3,117021493,microsoft/botbuilder-js,False,False
455e79e8adc6125112fffd10b34f39627bd011df,"Chrimc/form (#384)//* Intermediate check-in before inverting//template/prop loops.////* Working generator with incomplete templates.////* Basic .lu files working.////* Update to generate single .lu file.////* Fix cli issues.////* Fix CLI issues with template resources.////* Clean up lint warnings.////* Fix lint errors.////* Generate composite .lu////* Add dialog and multi-language support.////* shortcut to debug////* Add per-locale .lg file.////* Update debug config to use temp directory.//Generate multilingual .lg file.////* Update to include schema prefix on names.////* Fix bugs in .lg genertion.////* try help////* help and cancel////* Copy schema to output directory.////* help and cancel version 1////* separate help.lu////* several fixes////* remove help enum////* reset launch.json////* remove empty line////* Add the ability to copy library dialog files.////* Add ability to specify schema and multiple//templates.////* Rename resources.//Support multiple templates.//Add *PROPN** pattern.////* Fix bug in striingify call.////* Generate schema.main.dialog and update config.////* Update templates to newest format.////* Update templates to match names.////* add .dialogs for several basic rules////* Update templates to use $ and add begindialog as a hack to work around ada//ptive issue.////* add .dialogs for several basic rules////* fix comments////* merge from origin////* small changes////* Add formCopy cmd file.////* Adjust for bug in templates.////* fix path////* Version 1 of contact.form.dialog////* Same info is modeled for both Home and Work.//* List of state abbreviations and their spelled-out names are specified in the separate state.en-us.lu, and used in the $mappings specifications.//* Latitude and Longitude should be auto-filled if the corresponding address are filled.//* Validation patterns are specified for zip codes and phone numbers.////* Fixed contact.form.dialog and added activity.form.dialog////* contact.form.dialog//  - Fixed spelling//  - Use phonenumber prebuilt entity type//* activity.form.dialog: the second scenario from Darren ""An employee working for a customer wants to add a quick update to a customer record after a call. This update will then be available for other people working with that customer to see"".////* Added opportunity.form.dialog////For Darren's scenario ""An employee working with a customer has had a meeting and needs to create a new opportunity.""////* change names////* Revert ""change names""////This reverts commit 64ffaff4559cd4f5b10e39eb611b5b258e9ba8ea.////* change names////* basic work done for ask, set and help////* cancel confirmation////* cancel confirmation done, unexpected property set confirmation in progress////* improve unexpected property test////* Version 1 of contact.form.dialog////* Same info is modeled for both Home and Work.//* List of state abbreviations and their spelled-out names are specified in the separate state.en-us.lu, and used in the $mappings specifications.//* Latitude and Longitude should be auto-filled if the corresponding address are filled.//* Validation patterns are specified for zip codes and phone numbers.////* Fixed contact.form.dialog and added activity.form.dialog////* contact.form.dialog//  - Fixed spelling//  - Use phonenumber prebuilt entity type//* activity.form.dialog: the second scenario from Darren ""An employee working for a customer wants to add a quick update to a customer record after a call. This update will then be available for other people working with that customer to see"".////* Added opportunity.form.dialog////For Darren's scenario ""An employee working with a customer has had a meeting and needs to create a new opportunity.""////* rename state.lu////* prebuilt lu templates////* remove choose entity////we only have chooseProperty and clarifyEntity////* Switch to event expected.////* Update templates for latest runtime and add ask for//multiple properties.////* Add **NAMES/**NAME** and generate property names.////* fix unexpected property confirmation usage////* change unexpected property action from ask to sendactivity////* all done confirmation////* Update names to support chooseProperty.////* Check-in bread value hack.////* Fix template bug around clarify.////* Update templates to use names and start numbers.////* complete the new forms////* contextual help////* activity schema working fine////* add meta info to opportunity schema////* opportunity semi-working////cannot use phonenumber;//properties not in required also got asked;//in stringset, default value is not expression, cannot get the value for @email////* three schemas working////sandwich, activity, opportunity////* contact schema working////Adding welcome message in beginDialog,//Add help message for non-enum properties,//All three CDS schemas working////* Sync changes for demo.////* Before adding mapping templates////* Getting close to E2e.////* Largely working with some template debugging.////* Update the readme.////* Update to latest expression and lg packages.//Support app schema.////* Update standard schema.////* Finish merge.////* Show metaschema.////* Fix readme typo.////* several changes (#299)////* several changes////(1) remove unused old files;//(2) change incorrect file names;//(3) add string ask templates;//(4) remove meta properties from schemas;//(5) fix an error in calculating optional properties////* fix help property bug////* Add string templates.////* a few changes (#318)////(1) fix the cancel.lu bug//(2) add datetime.lu//(2) stringSetdatetime.dialog.lg////* Add template for not understood.////* Connect to bf cli.////* Add basic role support.////* Nigao/newtemplate (#321)////* a few changes////(1) fix the cancel.lu bug//(2) add datetime.lu//(2) stringSetdatetime.dialog.lg////* autohelp for new templates////* Update to use @{} everywhere and remove auto-help//since it required post-ask action.////* Nigao/newtemplate (#323)////* a few changes////(1) fix the cancel.lu bug//(2) add datetime.lu//(2) stringSetdatetime.dialog.lg////* autohelp for new templates////* add $requires, and datetime entity sets////* add all stringSet for prebuilt entities explicitly////* change prebuilt-entity.lu.lg files////* Switch to using a triggerIntent instead of none for entities.//Cleanup filename expressions.////* Fix bug in status.////* Switch from dialog:form to dialog:generate////* Add top-level documentation.////* Update tests to use dialog:generate.////* Rename tests to generator.////* Fixing linting errors////* Generate confirmation card.////* Fix reference regex ot not match structured lg.////* Minor bug fixes.////* Update to allow multi-lingual fallback.",https://github.com/microsoft/botframework-cli/commit/455e79e8adc6125112fffd10b34f39627bd011df,187076818,microsoft/botframework-cli,False,False
91881c3be6bf3888f97f86ff7d9b314871bf5d5b,"Initial check-in of dialog generation. (#353)//* Intermediate check-in before inverting//template/prop loops.////* Working generator with incomplete templates.////* Basic .lu files working.////* Update to generate single .lu file.////* Fix cli issues.////* Fix CLI issues with template resources.////* Clean up lint warnings.////* Fix lint errors.////* Generate composite .lu////* Add dialog and multi-language support.////* shortcut to debug////* Add per-locale .lg file.////* Update debug config to use temp directory.//Generate multilingual .lg file.////* Update to include schema prefix on names.////* Fix bugs in .lg genertion.////* try help////* help and cancel////* Copy schema to output directory.////* help and cancel version 1////* separate help.lu////* several fixes////* remove help enum////* reset launch.json////* remove empty line////* Add the ability to copy library dialog files.////* Add ability to specify schema and multiple//templates.////* Rename resources.//Support multiple templates.//Add *PROPN** pattern.////* Fix bug in striingify call.////* Generate schema.main.dialog and update config.////* Update templates to newest format.////* Update templates to match names.////* add .dialogs for several basic rules////* Update templates to use $ and add begindialog as a hack to work around ada//ptive issue.////* add .dialogs for several basic rules////* fix comments////* merge from origin////* small changes////* Add formCopy cmd file.////* Adjust for bug in templates.////* fix path////* Version 1 of contact.form.dialog////* Same info is modeled for both Home and Work.//* List of state abbreviations and their spelled-out names are specified in the separate state.en-us.lu, and used in the $mappings specifications.//* Latitude and Longitude should be auto-filled if the corresponding address are filled.//* Validation patterns are specified for zip codes and phone numbers.////* Fixed contact.form.dialog and added activity.form.dialog////* contact.form.dialog//  - Fixed spelling//  - Use phonenumber prebuilt entity type//* activity.form.dialog: the second scenario from Darren ""An employee working for a customer wants to add a quick update to a customer record after a call. This update will then be available for other people working with that customer to see"".////* Added opportunity.form.dialog////For Darren's scenario ""An employee working with a customer has had a meeting and needs to create a new opportunity.""////* change names////* Revert ""change names""////This reverts commit 64ffaff4559cd4f5b10e39eb611b5b258e9ba8ea.////* change names////* basic work done for ask, set and help////* cancel confirmation////* cancel confirmation done, unexpected property set confirmation in progress////* improve unexpected property test////* Version 1 of contact.form.dialog////* Same info is modeled for both Home and Work.//* List of state abbreviations and their spelled-out names are specified in the separate state.en-us.lu, and used in the $mappings specifications.//* Latitude and Longitude should be auto-filled if the corresponding address are filled.//* Validation patterns are specified for zip codes and phone numbers.////* Fixed contact.form.dialog and added activity.form.dialog////* contact.form.dialog//  - Fixed spelling//  - Use phonenumber prebuilt entity type//* activity.form.dialog: the second scenario from Darren ""An employee working for a customer wants to add a quick update to a customer record after a call. This update will then be available for other people working with that customer to see"".////* Added opportunity.form.dialog////For Darren's scenario ""An employee working with a customer has had a meeting and needs to create a new opportunity.""////* rename state.lu////* prebuilt lu templates////* remove choose entity////we only have chooseProperty and clarifyEntity////* Switch to event expected.////* Update templates for latest runtime and add ask for//multiple properties.////* Add **NAMES/**NAME** and generate property names.////* fix unexpected property confirmation usage////* change unexpected property action from ask to sendactivity////* all done confirmation////* Update names to support chooseProperty.////* Check-in bread value hack.////* Fix template bug around clarify.////* Update templates to use names and start numbers.////* complete the new forms////* contextual help////* activity schema working fine////* add meta info to opportunity schema////* opportunity semi-working////cannot use phonenumber;//properties not in required also got asked;//in stringset, default value is not expression, cannot get the value for @email////* three schemas working////sandwich, activity, opportunity////* contact schema working////Adding welcome message in beginDialog,//Add help message for non-enum properties,//All three CDS schemas working////* Sync changes for demo.////* Before adding mapping templates////* Getting close to E2e.////* Largely working with some template debugging.////* Update the readme.////* Update to latest expression and lg packages.//Support app schema.////* Update standard schema.////* Finish merge.////* Show metaschema.////* Fix readme typo.////* several changes (#299)////* several changes////(1) remove unused old files;//(2) change incorrect file names;//(3) add string ask templates;//(4) remove meta properties from schemas;//(5) fix an error in calculating optional properties////* fix help property bug////* Add string templates.////* a few changes (#318)////(1) fix the cancel.lu bug//(2) add datetime.lu//(2) stringSetdatetime.dialog.lg////* Add template for not understood.////* Connect to bf cli.////* Add basic role support.////* Nigao/newtemplate (#321)////* a few changes////(1) fix the cancel.lu bug//(2) add datetime.lu//(2) stringSetdatetime.dialog.lg////* autohelp for new templates////* Update to use @{} everywhere and remove auto-help//since it required post-ask action.////* Nigao/newtemplate (#323)////* a few changes////(1) fix the cancel.lu bug//(2) add datetime.lu//(2) stringSetdatetime.dialog.lg////* autohelp for new templates////* add $requires, and datetime entity sets////* add all stringSet for prebuilt entities explicitly////* change prebuilt-entity.lu.lg files////* Switch to using a triggerIntent instead of none for entities.//Cleanup filename expressions.////* Fix bug in status.////* Switch from dialog:form to dialog:generate////* Add top-level documentation.////* Update tests to use dialog:generate.////* Rename tests to generator.////* Fixing linting errors////* Generate confirmation card.////* Fix reference regex ot not match structured lg.",https://github.com/microsoft/botframework-cli/commit/91881c3be6bf3888f97f86ff7d9b314871bf5d5b,187076818,microsoft/botframework-cli,False,False
