sha,message,html_url,repository_id,repository_full_name,repository_private,repository_fork
19c8451e13fda6cfaa3703ef576d750df4b842f5,"Support for conditionally defined Python fields.//This allows us to support the pattern://if hyperparameter:/  obj.field_that_should_otherwise_not_be_present = value//Where field_name is otherwise undefined. This previously didn't work because composites like obj.field_name was returned from the staged AutoGraph conditional, meaning that both branches needed to supply a value for obj.field_name. Returning and setting composites is now restricted to conditionals that are staged in TensorFlow.//Note that a conditional that assigns to composite symbols that are not defined before the conditional will result in an AttributeError in staged TensorFlow code (i.e. if the condition is a Tensor). The error could be clearer see b/128519776 for follow up work in this direction.//PiperOrigin-RevId: 239030438",https://github.com/microsoft/tensorflow-directml/commit/19c8451e13fda6cfaa3703ef576d750df4b842f5,291217084,microsoft/tensorflow-directml,False,False
1d6a80cd9544ff89cb8a875ae08569f1cd0f0782,"[X86] Remove some composite MOVSS/MOVSD isel patterns.//These patterns looked for a MOVSS/SD followed by a scalar_to_vector. Or a scalar_to_vector followed by a load.//In both cases we emitted a MOVSS/SD for the MOVSS/SD part, a REG_CLASS for the scalar_to_vector, and a MOVSS/SD for the load.//But we have patterns that do each of those 3 things individually so there's no reason to build large patterns.//Most of the test changes are just reorderings. The one test that had a meaningful change is pr30430.ll and it appears to be a regression. But its doing -O0 so I think it missed a lot of opportunities and was just getting lucky before.//llvm-svn: 336762",https://github.com/microsoft/checkedc-clang/commit/1d6a80cd9544ff89cb8a875ae08569f1cd0f0782,60645050,microsoft/checkedc-clang,False,False
25618d5e9e9069ff4d1ff0edaba0f774f79eb4aa,"[X86] Remove some composite MOVSS/MOVSD isel patterns.//These patterns looked for a MOVSS/SD followed by a scalar_to_vector. Or a scalar_to_vector followed by a load.//In both cases we emitted a MOVSS/SD for the MOVSS/SD part, a REG_CLASS for the scalar_to_vector, and a MOVSS/SD for the load.//But we have patterns that do each of those 3 things individually so there's no reason to build large patterns.//Most of the test changes are just reorderings. The one test that had a meaningful change is pr30430.ll and it appears to be a regression. But its doing -O0 so I think it missed a lot of opportunities and was just getting lucky before.//git-svn-id: https://llvm.org/svn/llvm-project/llvm/trunk@336762 91177308-0d34-0410-b5e6-96231b3b80d8",https://github.com/microsoft/llvm/commit/25618d5e9e9069ff4d1ff0edaba0f774f79eb4aa,29704274,microsoft/llvm,False,False
25618d5e9e9069ff4d1ff0edaba0f774f79eb4aa,"[X86] Remove some composite MOVSS/MOVSD isel patterns.//These patterns looked for a MOVSS/SD followed by a scalar_to_vector. Or a scalar_to_vector followed by a load.//In both cases we emitted a MOVSS/SD for the MOVSS/SD part, a REG_CLASS for the scalar_to_vector, and a MOVSS/SD for the load.//But we have patterns that do each of those 3 things individually so there's no reason to build large patterns.//Most of the test changes are just reorderings. The one test that had a meaningful change is pr30430.ll and it appears to be a regression. But its doing -O0 so I think it missed a lot of opportunities and was just getting lucky before.//git-svn-id: https://llvm.org/svn/llvm-project/llvm/trunk@336762 91177308-0d34-0410-b5e6-96231b3b80d8",https://github.com/microsoft/checkedc-llvm/commit/25618d5e9e9069ff4d1ff0edaba0f774f79eb4aa,60644745,microsoft/checkedc-llvm,False,False
83fa9dacd7495dc2590c9510377e2db227bfbf84,"null tsid changes from pre tag to guid (#263)//* composite tsid and null styling////* CR fixed////* removed debugger////* null tsid changes from pre tag to guid////* more fixes to replace null guid with null string in places where we show alias////* test html page changes reverted////* nullformatting.html testcase////* CR fixes for showing null in tooltip splitby, groupname in legend and labels/axis in bar chart and scatter plot svgs////* d3 pattern is used in utils method instead of creating dom elements and appending each////* added fix for tooltip measure title null guid representation////* line height for null tsid styling added////Co-authored-by: darsney <matdar@microsoft.com>",https://github.com/microsoft/tsiclient/commit/83fa9dacd7495dc2590c9510377e2db227bfbf84,131655945,microsoft/tsiclient,False,False
