sha,message,html_url,repository_id,repository_full_name,repository_private,repository_fork
3c1d4b841d33d0b6e90ca676d9bf4a1402354b91,"Do not use superconsole::State in TimedList//Summary:/`TimedList` component now grabs `&SuperConsoleState` in constructor instead of fetching it from the state.//So `TimedList` is statically typed now. No more errors because code compiles but does not work because forgot to put something in the state.//Code is a bit rough, `SuperConsoleState` is too much for `TimedList`. Can be cleaned up later, even as is I consider this version a big improvement.//Next step would be:/* use this pattern everywhere else in buck2/* remove `State` from `superconsole` and recommend this pattern as default/* similarly we can remove `DrawMode` from `superconsole`//Reviewed By: bobyangyf//Differential Revision: D44814677//fbshipit-source-id: c7a0ca14c71bff9c226cd13a49156cbb44cc7ae9",https://github.com/facebook/buck2/commit/3c1d4b841d33d0b6e90ca676d9bf4a1402354b91,450625045,facebook/buck2,False,False
72c71c007e7bdf667e3fe69bf7dc3a87ae44c0ac,"fixing deploy script//to conform to new [envvar pattern](https://github.blog/changelog/2022-10-11-github-actions-deprecating-save-state-and-set-output-commands/), fixes #851 upstream",https://github.com/facebook/Rapid/commit/72c71c007e7bdf667e3fe69bf7dc3a87ae44c0ac,161120445,facebook/Rapid,False,False
2a34c5b8edb70315fe2c7ef63faefcb9359d2c63,"fby35: cl: revise PMIC error VinB_UV pattern (#1009)//Summary:/Revise PMIC error VinB_UV pattern.//Pull Request resolved: https://github.com/facebook/OpenBIC/pull/1009//Test Plan:/Build and test pass on fby35 system./1. Inject VinB_UV and check SEL root@bmc-oob:~# log-util all --print/2023 Mar 27 01:57:34 log-util: User cleared all logs/2    slot2    2023-03-27 01:57:53    ipmid            SEL Entry: FRU: 2, Record: Standard (0x02), Time: 2023-03-27 01:57:53, Sensor: PMIC_ERR (0xB4), Event Data: (050A00) DIMM A7 Vin Bulk UV Assertion/2    slot2    2023-03-27 01:57:56    gpiod            FRU: 2, System powered OFF/2    slot2    2023-03-27 01:57:58    ipmid            SEL Entry: FRU: 2, Record: Standard (0x02), Time: 2023-03-27 01:57:58, Sensor: ME_POWER_STATE (0x16), Event Data: (000000) RUNNING Assertion//Reviewed By: williamspatrick, tao-ren//Differential Revision: D44477822//Pulled By: amithash//fbshipit-source-id: a0f71027f518b42aa0de7b20f5b88f50381eb20a",https://github.com/facebook/OpenBIC/commit/2a34c5b8edb70315fe2c7ef63faefcb9359d2c63,335709078,facebook/OpenBIC,False,False
cc325bac6738435b253f646344df404247fc09a6,"thrift struct node template//Summary:/simplifying the migration and establishing a pattern to follow in switch state nodes//- define USE_THRIFT_COW(NODE)/- define base as ThriftStructNode<NODE, THRIFT_TYPE>/- provide explicit template instantiation in corresponding cpp file.//for maps similar pattern exist//- define Traits/- define base as ThriftMapNode<MAP, Traits>/- provide explicit template instantiation in corresponding cpp file.//Following this address all compiler errors and avoid copy.//Reviewed By: peygar//Differential Revision:/D40918338//LaMa Project: L1125642//fbshipit-source-id: 6a3236a25ddbfc9d830db48650baad632832e210",https://github.com/facebook/fboss/commit/cc325bac6738435b253f646344df404247fc09a6,31927407,facebook/fboss,False,False
e4c05c8fe17d83a85f1105bc8580533317c1f7d6,"[clang] New preanalysis to substitute away mock pointers//Summary:/This aims to substitute away mock pointers from the code. This consists of a programming pattern where developers use global variables that contain a function pointer, where the function pointer points to the real function that we want to call in the production code, and gets swapped by a dummy function for testing.//Before, we had some support for this pattern in Pulse, but now we add support in the frontend: we identify such global function pointers, substitute their use with the actual function and remove the initializer code for such global variables.//The result is simpler code where Pulse analysis is easier to debug, and the analysis is also more performant, since fewer global variables are convoluting the state, and the method calls don't involve an extra step of calling the global initializer.//I left the Pulse support around because that's not specific to mock pointers, but works for any global function pointers.//Reviewed By: ezgicicek//Differential Revision:/D43838894//Privacy Context Container: L1122176//fbshipit-source-id: 3d3cbe9e2295b183b8ceeb26b5537dfbdeb4f979",https://github.com/facebook/infer/commit/e4c05c8fe17d83a85f1105bc8580533317c1f7d6,29857799,facebook/infer,False,False
07ea96ffe140089ed19b54cef31d4d144d4f437c,"Add multiline_parser support//Summary://FluentBit added support for multiline parsers on v1.8 (https://docs.fluentbit.io/manual/v/1.9-pre/administration/configuring-fluent-bit/multiline-parsing). On this commit we are adding support to the coobook to be able to configure them based on configurations.//While the `tail` input had multiline support in older version (via the `multiline` boolean property), the new one allows for more complex rules. (https://docs.fluentbit.io/manual/v/1.9-pre/pipeline/inputs/tail#multiline-support)//The parsers.conf will be appended according to the following:/```/node.default['fb_fluentbit']['multiline_parser']['my_multi_parse'] = {/  'type' => 'regex',/  'flush_timeout' => '1000',/  'rules' => [/    {/      'state_name' => 'start_state',/      'pattern' => '/^\d{4}\-\d{2}\-\d{2} \d{2}\:\d{2}\:\d{2},\d+ .*$/',/      'next_state' => 'cont',/    },/    {/      'state_name' => 'cont',/      'pattern' => '/^ - .*/',/      'next_state' => 'cont',/    },/  ],/}/```//Please read the FluentBit documentation for proper rules definitions: (https://docs.fluentbit.io/manual/v/1.9-pre/administration/configuring-fluent-bit/multiline-parsing#rules-definition)//Reviewed By: joshuamiller01, leoswaldo//Differential Revision: D41417395//fbshipit-source-id: 5380865d63ea07ce8da012fb6fcf16d4b45c465c",https://github.com/facebook/chef-cookbooks/commit/07ea96ffe140089ed19b54cef31d4d144d4f437c,48260686,facebook/chef-cookbooks,False,False
c826dc50de288758a0b783b2fd37b40a3b512fc4,"Add (Client) Functions as Form Actions (#26674)//This lets you pass a function to `<form action={...}>` or `<button//formAction={...}>` or `<input type=""submit formAction={...}>`. This will//behave basically like a `javascript:` URL except not quite implemented//that way. This is a convenience for the `onSubmit={e => {//e.preventDefault(); const fromData = new FormData(e.target); ... }`//pattern.////You can still implement a custom `onSubmit` handler and if it calls//`preventDefault`, it won't invoke the action, just like it would if you//used a full page form navigation or javascript urls. It behaves just//like a navigation and we might implement it with the Navigation API in//the future.////Currently this is just a synchronous function but in a follow up this//will accept async functions, handle pending states and handle errors.////This is implemented by setting `javascript:` URLs, but these only exist//to trigger an error message if something goes wrong instead of//navigating away. Like if you called `stopPropagation` to prevent React//from handling it or if you called `form.submit()` instead of//`form.requestSubmit()` which by-passes the `submit` event. If CSP is//used to ban `javascript:` urls, those will trigger errors when these//URLs are invoked which would be a different error message but it's still//there to notify the user that something went wrong in the plumbing.////Next up is improving the SSR state with action replaying and progressive//enhancement.",https://github.com/facebook/react/commit/c826dc50de288758a0b783b2fd37b40a3b512fc4,10270250,facebook/react,False,False
12a1d140e366aa8d95338e4412117f16da79a078,"Don't prerender siblings of suspended component  (#26380)//Today if something suspends, React will continue rendering the siblings//of that component.////Our original rationale for prerendering the siblings of a suspended//component was to initiate any lazy fetches that they might contain. This//was when we were more bullish about lazy fetching being a good idea some//of the time (when combined with prefetching), as opposed to our latest//thinking, which is that it's almost always a bad idea.////Another rationale for the original behavior was that the render was I/O//bound, anyway, so we might as do some extra work in the meantime. But//this was before we had the concept of instant loading states: when//navigating to a new screen, it's better to show a loading state as soon//as you can (often a skeleton UI), rather than delay the transition.//(There are still cases where we block the render, when a suitable//loading state is not available; it's just not _all_ cases where//something suspends.) So the biggest issue with our existing//implementation is that the prerendering of the siblings happens within//the same render pass as the one that suspended — _before_ the loading//state appears.////What we should do instead is immediately unwind the stack as soon as//something suspends, to unblock the loading state.////If we want to preserve the ability to prerender the siblings, what we//could do is schedule special render pass immediately after the fallback//is displayed. This is likely what we'll do in the future. However, in//the new implementation of `use`, there's another reason we don't//prerender siblings: so we can preserve the state of the stack when//something suspends, and resume where we left of when the promise//resolves without replaying the parents. The only way to do this//currently is to suspend the entire work loop. Fiber does not currently//support rendering multiple siblings in ""parallel"". Once you move onto//the next sibling, the stack of the previous sibling is discarded and//cannot be restored. We do plan to implement this feature, but it will//require a not-insignificant refactor.////Given that lazy data fetching is already bad for performance, the best//trade off for now seems to be to disable prerendering of siblings. This//gives us the best performance characteristics when you're following best//practices (i.e. hoist data fetches to Server Components or route//loaders), at the expense of making an already bad pattern a bit worse.////Later, when we implement resumable context stacks, we can reenable//sibling prerendering. Though even then the use case will mostly be to//prerender the CPU-bound work, not lazy fetches.",https://github.com/facebook/react/commit/12a1d140e366aa8d95338e4412117f16da79a078,10270250,facebook/react,False,False
034d76860cead1fa640edf49fdc0ee3f06c65be8,remove wildcard pattern matches of FlowLsp.server_state//Summary:/i am considering adding another constructor to this variant and so want it to be safe//Changelog: [internal]//Reviewed By: samwgoldman//Differential Revision: D38141733//fbshipit-source-id: 8af7435eb9ead47fb1122413b9affc5931a67045,https://github.com/facebook/flow/commit/034d76860cead1fa640edf49fdc0ee3f06c65be8,25880891,facebook/flow,False,False
0ffb15ecad9193d7f96036219f7eb2bab5b47332,refactor restoring packages from saved state//Summary:/moves restoring packages into the RestoreHeaps timer and makes it follow the same pattern as parsed and unparsed.//I didn't make it use the workers since there aren't that many packages and the overhead of workers on Windows is so high. perhaps we could have one set of workers do all 3 kinds of jobs though.//Changelog: [internal]//Reviewed By: samwgoldman//Differential Revision: D41061833//fbshipit-source-id: 541d39415f49fe46666c3e3c3e1af4d33cda6d0a,https://github.com/facebook/flow/commit/0ffb15ecad9193d7f96036219f7eb2bab5b47332,25880891,facebook/flow,False,False
6bab7e0924fb0a3e727db654b37554dfd6cf95f9,"GT/GTI: FW-util: Change GPU SXM from 0-based to 1-based (#3627)//Summary:/According to NV online#1069815 ""NVIDIA HGX Baseboard Redfish Design Collaterals"".//• Id pattern for GPUs are 1-based. Example: ""GPU_SXM_<1N>""//X-link: https://github.com/facebookexternal/openbmc.quanta/pull/3627//Test Plan:/1. Get version (Pass)/root@bmc-oob:~# fw-util hgx  --version/erot-gpu1 Version: 00.02.0083.0000_n00/erot-gpu2 Version: 00.02.0083.0000_n00/erot-gpu3 Version: 00.02.0083.0000_n00/erot-gpu4 Version: 00.02.0083.0000_n00//2. Update FW (Pass)/root@bmc-oob:~# fw-util hgx --update gpu3-fw /tmp/nvfw_HGX-H100x8_0003_230122.3.0_prod-signed.fwpkg target: {""HttpPushUriTargets"":[""/redfish/v1/UpdateService/FirmwareInventory/HGX_FW_GPU_SXM_3""]} Started update task: 0/The task with id 0 has started./Image '96.00.51.00.03' is being transferred to 'HGX_FW_GPU_SXM_3'. Awaiting for an action to proceed with activating image '96.00.51.00.03' on 'HGX_FW_GPU_SXM_3'. The task with id 0 has Completed./Update completed with state: Completed status: OK/Upgrade of hgx : gpu3-fw succeeded//Reviewed By: zhdaniel12//Differential Revision: D43504108//fbshipit-source-id: 0fbbcf9a14b73aacbfeffdc9d96c591db059611f",https://github.com/facebook/openbmc/commit/6bab7e0924fb0a3e727db654b37554dfd6cf95f9,31917712,facebook/openbmc,False,False
9686fab9332fee4fe724ce029cde36fca59e3cf7,"Refactor OptionsModal into UseModal//Summary:/We had a `useOptionsModal` utility, which creates a modal, adds it to a global state, then adds proper listeners for closing the modal on escape key, or if you click the 'x' in the top right, and sets up the right width for it, etc.//In this diff, I expand this to a more general `useModal` hook. This allows you to either use the more direct `{type: 'confirm', message: ..., buttons: ...}` API, or a more customizable `{type: 'custom', component: ...}` API. For file-a-bug, we'll use the more complicated API.//Without such a useModal util, right now you'd have to add a new <Modal> render on <App>, which needs its own global state management, then your own dismissing logic. This is sometimes needed, for example the Comparison View which does a lot of custom stuff.//But many smaller modals will fit a `useModal` pattern. For example, we may add a modal flow for Landing code, which would need custom rendering.//This API extension works like this://```tsx/function SomeComponent() {/  const showModal = useModal();/  return <div>/    <button onClick={async () => {/       const result = await showModal({/         type: 'custom',/         component: MyModalRendererComponent,/         title: 'hello'/       });/       // now result is what the modal returned to us, which we can use for further processing/    }/  </div>/}//type MyData = {foo: string};//function MyModalRendererComponent({returnResultAndDismiss}: {returnResultAndDismiss: (data: MyData) => void}) {/  return <div>/    Custom modal content!/    <button onClick={() => {/      returnResultAndDismiss({foo: 'bar'});/    }}>Return some data</button>/  </div>;/}/```//We'll use this API later in the stack for file-a-bug, where the modal contains all the file-a-bug fields (title, description, ...),/and it returns that data to the code path where we open the modal.//Reviewed By: bolinfest//Differential Revision: D42818652//fbshipit-source-id: 4616690363f744762f6a46abf677123008127813",https://github.com/facebook/sapling/commit/9686fab9332fee4fe724ce029cde36fca59e3cf7,58146669,facebook/sapling,False,False
30adbcc06404e8bd034b2d6909c3886a86456954,"service: remove race between mount shutdown and Thrift calls//Summary:/The isSafeForInodeAccess is used to know when the root inode is initialized and/valid, but this is used in racy context. For instance, the getMountPoints/collects all the mounts whose root inode is initialized, but then releases the/lock on the mountPoints_ list, subsequently, the EdenMount's root Inode is/accessed without checking. If the EdenMount is shutdown prior to the root Inode/being copied, the root Inode might be a nullptr, causing a NULL-dereference.//This pattern can be found in all of the Thrift entry points that play with/mounts and thus are all potentially sources of EdenFS crashes. To solve this,/we need to guarantee 2 things:/ - isSafeForInodeAccess must only change state while the mountPoints_ lock is/   held, specifically at shutdown time,/ - The root inode must be copied while the mountPoints_ lock is held.//This diff does both. For the second one in particular EdenServer::getMount is/modified to also return the root Inode. This is done instead of introducing a new/function to prevent future bugs from seeping in that may be missed at review time.//Reviewed By: chadaustin//Differential Revision: D42563083//fbshipit-source-id: c0267277a54c425f330bbd58d1dc86ec3746502d",https://github.com/facebook/sapling/commit/30adbcc06404e8bd034b2d6909c3886a86456954,58146669,facebook/sapling,False,False
c650da95c4afe57eef72e4d224144d08d3454ae1,"1/3 add ServerProgress.Errors library//Summary:/This diff adds an API, `ServerProgress.Errors`, for the streaming error file. This is its design:/```/OVERVIEW OF STREAMING ERRORS FILE//Errors is a file in /tmp/hh_server/<repo>/errors.bin which is written/by server during a typecheck. The file is first created when the server/starts its first typecheck, gets errors appended to it as the typecheck/discovers them, is unlinked and then another one with the same name/created each time the server starts another typecheck, and the file is finally/unlinked upon server exit. A ""typecheck"" can be thought of as a typecheck of the/entire program, and hence the errors file will contain every error reported in WWW./But in reality the server does tricks to typecheck a smaller number of files just/so long as it still manages to report every error into the file.//Therefore: a client can at any time open an file descriptor to this file,/and ""tail -f -n +1"" (i.e. read from the start and then follow) to follow/the typecheck that is currently underway or most recently completed, from its/start to its end. It will still be able to read the file descriptor through/to its end even if, in the meantime, a new typecheck has started and the old/file has been unlinked. Note that a given file-descriptor will only ever point/to a file which monitonically grows.//The server can have its typecheck interrupted. Some interruptions like watchman/will cause the current typecheck to be cancelled, then a new typecheck started./In this case the existing errors file will be unlinked, a new errors file created/for the new typecheck, and a sentinel will be written into the old file descriptor/to show that it ended before completing. Other interruptions like from/""hh --type-at-pos"" will have no effect: the current typecheck file can continue/being read just fine. If a client reads a file descriptor on its sentinel, that is/a guarantee that a new errors file is already in place and can be opened (or,/if no errors file exists, that can only be because the server has terminated).//If file does not exist, the client knows that either there is no server, or there/is one but it has not yet started typechecking (it might still be loading saved state)./In either case it is appropriate for the client to clientConnect {autostart_server=true}/in the normal way, until it establishes a connection to the server, and then it can/wait for the errors file.//SEMANTICS OF ERRORS-FILE CONTENTS//* An errors-file is tied to a particular watchman clock value. It reflects/  all file-changes that happened prior to the clock. (As to whether it reflects/  any file-changes that happened after the clock, that is impossible to tell.)/* As mentioned above, when the errors-file is complete, it contains the full/  set of errors that hh_server knows about for the project./* Each error report is an Errors.error list Relative_path.map, i.e. it encompasses/  several files, and for each file it has a list of errors. Currently we make/  one report for all ""duplicate name"" errors across the project if any, followed by/  one report per batch that had errors. This means that a file might be mentioned/  twice, once in a ""duplicate name"" report, once later. This will change in future/  so that each file is reported only once./* It currently does not write empty reports, though that might change in future/  (e.g. we might decide to write ""no errors in file a.php"" for a file which/  previously did have errors)./* Within a single report, the error list has been sorted and de-duped./```//There are a few design decisions not mentioned in the doc-comments which I'll note here.../1. I decided to stick this into the existing `ServerProgress.ml` rather than making a new file or new buck target. That's because it feels like progress.json and errors.bin are so very similar./   1. However, ServerProgressLwt.ml has to be a separate module, because hh_server isn't allowed to link to Lwt/   2. We have an existing convention that ""server/monitorConnection"" is a low-level module that combines RPC types, writing and reading functions. Similarly, ""server/serverProgress"" is a module that combines RPC types, writing and reading functions./2. I decided to make all the functions global. That reflects the fact that `root` is already global in both the server and client binaries (e.g. through Relative_path.set_prefix). It also reflects the fact that only one instance of hh_server can even exist for a given repository. That's as global as you can get!/3. We have to deal with what happens when a client connects to an errors.bin that was written by a later or earlier version of hh_server. I copied our existing pattern from monitorConnection, of having a loosely typed field `extra : Hh_json.json`, to allow for forward and backward compatibility without breaking the serialization format./4. `ignore_hh_version` is currently controlled by the server, and I preserved that behavior. Thus for instance `hh start --ignore-hh-version` will allow all versions of the client to connect to it. (But using the flag in the client doesn't allow it to connect to arbitrary versions of the server).//## How to review this diff/1. Although it says ""1300 lines changed in this diff"", 650 of them are tests and 100 of them are docblocks, so it's really only 550 lines.../2. Read the big block of text in the summary/3. Read the `test_completed` and `test_async_read_completed ` unit tests. They show straightforward success cases that illustrate the API for consuming errors./4. Focus on the producing side now. Read the ServerProgress.mli docblock on `write_state`, and docblocks for the other producing APIs in this module `new_empty_file`, `report`, `complete`, `unlink`. Now read the unit test case `test_produce_disordered`. This shows the ""state-machine model"" for producing errors./5. Read ServerProgress.ml for the implementation. From a concurrency correctness perspective, focus on `with_lock`, `write_message`, `read_message`, `unlink_sentinel_close`. The rest of the methods are straightforward./6. Read SeverProgressLwt.{mli,ml}//Reviewed By: CatherineGasnier//Differential Revision: D44159582//fbshipit-source-id: d469c91de267947fa490d3d47e152843439c97c3",https://github.com/facebook/hhvm/commit/c650da95c4afe57eef72e4d224144d08d3454ae1,455600,facebook/hhvm,False,False
d8aee3da2aa57ec373a0aa01c396b47d7f59e9f2,"Implement nested operations whereby RSC is set during render (and nested render) phase, and LSC is set during layout (and nested layout) phase//Summary:/In this diff, an RSC is set on the CC during the render phase, and a LSC is set during layout phase. In between these phases, the respective context is cleared.//This diff also introduces this pattern for ""nested"" operations, such as during component.measure & layout.measureNestedTree - which both save the ""current"" state-context, then set their own sequence of RSC & LSC, and finish by restoring the previous state-context.//For tests, the major difference here is that we no longer simply need to set a LSC-for-tests. Instead, an RSC is usually expected. To that end, a new set-RSC-for-tests method has been added to CC.//All litho tests and test helpers have been adapted to this new paradigm//Reviewed By: astreet//Differential Revision: D39502953//fbshipit-source-id: 7630fb996ef09d46096dcdb317834296073f4d94",https://github.com/facebook/litho/commit/d8aee3da2aa57ec373a0aa01c396b47d7f59e9f2,80179724,facebook/litho,False,False
