sha,message,html_url,repository_id,repository_full_name,repository_private,repository_fork
86ead2eb964e09b25fa38f35ed622a54acde87f8,"Tighten companion-by-udid invariants//Summary:/The intent here is to take domain logic out of the CompanionSet. This makes it even more of a dumb wrapper around state.//As a result of this change, we can tighten invariants within the ManagementClient://- Companion spawning will fail earlier if there's no matching target for a given udid./- Explicit fallback of ""no local targets"" when running in ""companionless"" environments./- No re-raising of exceptions/- Case analysis (closer to pattern matching) for all of the ""companion by udid"" cases.//Reviewed By: jbardini//Differential Revision: D31994843//fbshipit-source-id: be92077cef16f0f719f86c8daa9cd65256076d24",https://github.com/facebook/idb/commit/86ead2eb964e09b25fa38f35ed622a54acde87f8,41870517,facebook/idb,False,False
3a64804b41df9af1ebb1b7f97586f74278a89edb,"[erl-pulse] Bugfix in handling dynamic types//Summary:/Pulse models for built-in Erlang functions sometimes have the pattern/""if type of x is T, then access these fields of x"". The ""if"" part was/sometimes producing a subtly unsatisfiable state: attributes say that x/is an invalid reference, but path condition requires that x has type T./This led to a crash.//The fix here works by not producing ""subtly unsatisfiable"" states, but/by explicitly pruning the exploration of such execution paths.//Reviewed By: mmarescotti//Differential Revision: D31543370//fbshipit-source-id: 88cd4299e",https://github.com/facebook/infer/commit/3a64804b41df9af1ebb1b7f97586f74278a89edb,29857799,facebook/infer,False,False
875b48aba30cf7dcb03ecb3d5cb16f1ccfda6843,"[inline-requires] Make named imports work (#246)//Patterns like `import {name} from 'module'` were not working properly.//This adds support for that pattern.////In addition, state is local to the traversal, to avoid leaking paths after using the plugin.",https://github.com/facebook/fbjs/commit/875b48aba30cf7dcb03ecb3d5cb16f1ccfda6843,36469177,facebook/fbjs,False,False
25d8341f9750a8825dcdb7762d0bc9843814520f,Optimize ConcatStrStr pairs to ConcatStr3//Summary:/When we see a pattern where/```/t1 = ConcatStrStr a b/t2 = ConcatStrStr t1 c/```/we can convert this into/```/t2 = ConcatStr3 a b c/```/if all uses of `t1` are/* `t2 = ConcatStrStr t1 c`/* `Decref t1`/* `StStk` in catch traces//Note: `StStk` in catch traces comes from bringing the unwinder to a consistent state so that it properly unwind the stack.//Reviewed By: ottoni//Differential Revision: D28293952//fbshipit-source-id: 216c47d2400af57bb89fd8d9df1acdc357b00a90,https://github.com/facebook/hhvm/commit/25d8341f9750a8825dcdb7762d0bc9843814520f,455600,facebook/hhvm,False,False
5724348689c7b6f51a3bbca5723af2185b77653e,"Revamp, optimize new experimental clock cache (#10626)//Summary:/* Consolidates most metadata into a single word per slot so that more/can be accomplished with a single atomic update. In the common case,/Lookup was previously about 4 atomic updates, now just 1 atomic update./Common case Release was previously 1 atomic read + 1 atomic update,/now just 1 atomic update./* Eliminate spins / waits / yields, which likely threaten some ""lock free""/benefits. Compare-exchange loops are only used in explicit Erase, and/strict_capacity_limit=true Insert. Eviction uses opportunistic compare-/exchange./* Relaxes some aggressiveness and guarantees. For example,/  * Duplicate Inserts will sometimes go undetected and the shadow duplicate/    will age out with eviction./  * In many cases, the older Inserted value for a given cache key will be kept/  (i.e. Insert does not support overwrite)./  * Entries explicitly erased (rather than evicted) might not be freed/  immediately in some rare cases./  * With strict_capacity_limit=false, capacity limit is not tracked/enforced as/  precisely as LRUCache, but is self-correcting and should only deviate by a/  very small number of extra or fewer entries./* Use smaller ""computed default"" number of cache shards in many cases,/because benefits to larger usage tracking / eviction pools outweigh the small/cost of more lock-free atomic contention. The improvement in CPU and I/O/is dramatic in some limit-memory cases./* Even without the sharding change, the eviction algorithm is likely more/effective than LRU overall because it's more stateful, even though the/""hot path"" state tracking for it is essentially free with ref counting. It/is like a generalized CLOCK with aging (see code comments). I don't have/performance numbers showing a specific improvement, but in theory, for a/Poisson access pattern to each block, keeping some state allows better/estimation of time to next access (Poisson interval) than strict LRU. The/bounded randomness in CLOCK can also reduce ""cliff"" effect for repeated/range scans approaching and exceeding cache size.//## Hot path algorithm comparison/Rough descriptions, focusing on number and kind of atomic operations:/* Old `Lookup()` (2-5 atomic updates per probe):/```/Loop:/  Increment internal ref count at slot/  If possible hit:/    Check flags atomic (and non-atomic fields)/    If cache hit:/      Three distinct updates to 'flags' atomic/      Increment refs for internal-to-external/      Return/  Decrement internal ref count/while atomic read 'displacements' > 0/```/* New `Lookup()` (1-2 atomic updates per probe):/```/Loop:/  Increment acquire counter in meta word (optimistic)/  If visible entry (already read meta word):/    If match (read non-atomic fields):/      Return/    Else:/      Decrement acquire counter in meta word/  Else if invisible entry (rare, already read meta word):/    Decrement acquire counter in meta word/while atomic read 'displacements' > 0/```/* Old `Release()` (1 atomic update, conditional on atomic read, rarely more):/```/Read atomic ref count/If last reference and invisible (rare):/  Use CAS etc. to remove/  Return/Else:/  Decrement ref count/```/* New `Release()` (1 unconditional atomic update, rarely more):/```/Increment release counter in meta word/If last reference and invisible (rare):/  Use CAS etc. to remove/  Return/```//## Performance test setup/Build DB with/```/TEST_TMPDIR=/dev/shm ./db_bench -benchmarks=fillrandom -num=30000000 -disable_wal=1 -bloom_bits=16/```/Test with/```/TEST_TMPDIR=/dev/shm ./db_bench -benchmarks=readrandom -readonly -num=30000000 -bloom_bits=16 -cache_index_and_filter_blocks=1 -cache_size=${CACHE_MB}000000 -duration 60 -threads=$THREADS -statistics/```/Numbers on a single socket Skylake Xeon system with 48 hardware threads, DEBUG_LEVEL=0 PORTABLE=0. Very similar story on a dual socket system with 80 hardware threads. Using (every 2nd) Fibonacci MB cache sizes to sample the territory between powers of two. Configurations://base: LRUCache before this change, but with db_bench change to default cache_numshardbits=-1 (instead of fixed at 6)/folly: LRUCache before this change, with folly enabled (distributed mutex) but on an old compiler (sorry)/gt_clock: experimental ClockCache before this change/new_clock: experimental ClockCache with this change//## Performance test results/First test ""hot path"" read performance, with block cache large enough for whole DB:/4181MB 1thread base -> kops/s: 47.761/4181MB 1thread folly -> kops/s: 45.877/4181MB 1thread gt_clock -> kops/s: 51.092/4181MB 1thread new_clock -> kops/s: 53.944//4181MB 16thread base -> kops/s: 284.567/4181MB 16thread folly -> kops/s: 249.015/4181MB 16thread gt_clock -> kops/s: 743.762/4181MB 16thread new_clock -> kops/s: 861.821//4181MB 24thread base -> kops/s: 303.415/4181MB 24thread folly -> kops/s: 266.548/4181MB 24thread gt_clock -> kops/s: 975.706/4181MB 24thread new_clock -> kops/s: 1205.64 (~= 24 * 53.944)//4181MB 32thread base -> kops/s: 311.251/4181MB 32thread folly -> kops/s: 274.952/4181MB 32thread gt_clock -> kops/s: 1045.98/4181MB 32thread new_clock -> kops/s: 1370.38//4181MB 48thread base -> kops/s: 310.504/4181MB 48thread folly -> kops/s: 268.322/4181MB 48thread gt_clock -> kops/s: 1195.65/4181MB 48thread new_clock -> kops/s: 1604.85 (~= 24 * 1.25 * 53.944)//4181MB 64thread base -> kops/s: 307.839/4181MB 64thread folly -> kops/s: 272.172/4181MB 64thread gt_clock -> kops/s: 1204.47/4181MB 64thread new_clock -> kops/s: 1615.37//4181MB 128thread base -> kops/s: 310.934/4181MB 128thread folly -> kops/s: 267.468/4181MB 128thread gt_clock -> kops/s: 1188.75/4181MB 128thread new_clock -> kops/s: 1595.46//Whether we have just one thread on a quiet system or an overload of threads, the new version wins every time in thousand-ops per second, sometimes dramatically so. Mutex-based implementation quickly becomes contention-limited. New clock cache shows essentially perfect scaling up to number of physical cores (24), and then each hyperthreaded core adding about 1/4 the throughput of an additional physical core (see 48 thread case). Block cache miss rates (omitted above) are negligible across the board. With partitioned instead of full filters, the maximum speed-up vs. base is more like 2.5x rather than 5x.//Now test a large block cache with low miss ratio, but some eviction is required:/1597MB 1thread base -> kops/s: 46.603 io_bytes/op: 1584.63 miss_ratio: 0.0201066 max_rss_mb: 1589.23/1597MB 1thread folly -> kops/s: 45.079 io_bytes/op: 1530.03 miss_ratio: 0.019872 max_rss_mb: 1550.43/1597MB 1thread gt_clock -> kops/s: 48.711 io_bytes/op: 1566.63 miss_ratio: 0.0198923 max_rss_mb: 1691.4/1597MB 1thread new_clock -> kops/s: 51.531 io_bytes/op: 1589.07 miss_ratio: 0.0201969 max_rss_mb: 1583.56//1597MB 32thread base -> kops/s: 301.174 io_bytes/op: 1439.52 miss_ratio: 0.0184218 max_rss_mb: 1656.59/1597MB 32thread folly -> kops/s: 273.09 io_bytes/op: 1375.12 miss_ratio: 0.0180002 max_rss_mb: 1586.8/1597MB 32thread gt_clock -> kops/s: 904.497 io_bytes/op: 1411.29 miss_ratio: 0.0179934 max_rss_mb: 1775.89/1597MB 32thread new_clock -> kops/s: 1182.59 io_bytes/op: 1440.77 miss_ratio: 0.0185449 max_rss_mb: 1636.45//1597MB 128thread base -> kops/s: 309.91 io_bytes/op: 1438.25 miss_ratio: 0.018399 max_rss_mb: 1689.98/1597MB 128thread folly -> kops/s: 267.605 io_bytes/op: 1394.16 miss_ratio: 0.0180286 max_rss_mb: 1631.91/1597MB 128thread gt_clock -> kops/s: 691.518 io_bytes/op: 9056.73 miss_ratio: 0.0186572 max_rss_mb: 1982.26/1597MB 128thread new_clock -> kops/s: 1406.12 io_bytes/op: 1440.82 miss_ratio: 0.0185463 max_rss_mb: 1685.63//610MB 1thread base -> kops/s: 45.511 io_bytes/op: 2279.61 miss_ratio: 0.0290528 max_rss_mb: 615.137/610MB 1thread folly -> kops/s: 43.386 io_bytes/op: 2217.29 miss_ratio: 0.0289282 max_rss_mb: 600.996/610MB 1thread gt_clock -> kops/s: 46.207 io_bytes/op: 2275.51 miss_ratio: 0.0290057 max_rss_mb: 637.934/610MB 1thread new_clock -> kops/s: 48.879 io_bytes/op: 2283.1 miss_ratio: 0.0291253 max_rss_mb: 613.5//610MB 32thread base -> kops/s: 306.59 io_bytes/op: 2250 miss_ratio: 0.0288721 max_rss_mb: 683.402/610MB 32thread folly -> kops/s: 269.176 io_bytes/op: 2187.86 miss_ratio: 0.0286938 max_rss_mb: 628.742/610MB 32thread gt_clock -> kops/s: 855.097 io_bytes/op: 2279.26 miss_ratio: 0.0288009 max_rss_mb: 733.062/610MB 32thread new_clock -> kops/s: 1121.47 io_bytes/op: 2244.29 miss_ratio: 0.0289046 max_rss_mb: 666.453//610MB 128thread base -> kops/s: 305.079 io_bytes/op: 2252.43 miss_ratio: 0.0288884 max_rss_mb: 723.457/610MB 128thread folly -> kops/s: 269.583 io_bytes/op: 2204.58 miss_ratio: 0.0287001 max_rss_mb: 676.426/610MB 128thread gt_clock -> kops/s: 53.298 io_bytes/op: 8128.98 miss_ratio: 0.0292452 max_rss_mb: 956.273/610MB 128thread new_clock -> kops/s: 1301.09 io_bytes/op: 2246.04 miss_ratio: 0.0289171 max_rss_mb: 788.812//The new version is still winning every time, sometimes dramatically so, and we can tell from the maximum resident memory numbers (which contain some noise, by the way) that the new cache is not cheating on memory usage. IMPORTANT: The previous generation experimental clock cache appears to hit a serious bottleneck in the higher thread count configurations, presumably due to some of its waiting functionality. (The same bottleneck is not seen with partitioned index+filters.)//Now we consider even smaller cache sizes, with higher miss ratios, eviction work, etc.//233MB 1thread base -> kops/s: 10.557 io_bytes/op: 227040 miss_ratio: 0.0403105 max_rss_mb: 247.371/233MB 1thread folly -> kops/s: 15.348 io_bytes/op: 112007 miss_ratio: 0.0372238 max_rss_mb: 245.293/233MB 1thread gt_clock -> kops/s: 6.365 io_bytes/op: 244854 miss_ratio: 0.0413873 max_rss_mb: 259.844/233MB 1thread new_clock -> kops/s: 47.501 io_bytes/op: 2591.93 miss_ratio: 0.0330989 max_rss_mb: 242.461//233MB 32thread base -> kops/s: 96.498 io_bytes/op: 363379 miss_ratio: 0.0459966 max_rss_mb: 479.227/233MB 32thread folly -> kops/s: 109.95 io_bytes/op: 314799 miss_ratio: 0.0450032 max_rss_mb: 400.738/233MB 32thread gt_clock -> kops/s: 2.353 io_bytes/op: 385397 miss_ratio: 0.048445 max_rss_mb: 500.688/233MB 32thread new_clock -> kops/s: 1088.95 io_bytes/op: 2567.02 miss_ratio: 0.0330593 max_rss_mb: 303.402//233MB 128thread base -> kops/s: 84.302 io_bytes/op: 378020 miss_ratio: 0.0466558 max_rss_mb: 1051.84/233MB 128thread folly -> kops/s: 89.921 io_bytes/op: 338242 miss_ratio: 0.0460309 max_rss_mb: 812.785/233MB 128thread gt_clock -> kops/s: 2.588 io_bytes/op: 462833 miss_ratio: 0.0509158 max_rss_mb: 1109.94/233MB 128thread new_clock -> kops/s: 1299.26 io_bytes/op: 2565.94 miss_ratio: 0.0330531 max_rss_mb: 361.016//89MB 1thread base -> kops/s: 0.574 io_bytes/op: 5.35977e+06 miss_ratio: 0.274427 max_rss_mb: 91.3086/89MB 1thread folly -> kops/s: 0.578 io_bytes/op: 5.16549e+06 miss_ratio: 0.27276 max_rss_mb: 96.8984/89MB 1thread gt_clock -> kops/s: 0.512 io_bytes/op: 4.13111e+06 miss_ratio: 0.242817 max_rss_mb: 119.441/89MB 1thread new_clock -> kops/s: 48.172 io_bytes/op: 2709.76 miss_ratio: 0.0346162 max_rss_mb: 100.754//89MB 32thread base -> kops/s: 5.779 io_bytes/op: 6.14192e+06 miss_ratio: 0.320399 max_rss_mb: 311.812/89MB 32thread folly -> kops/s: 5.601 io_bytes/op: 5.83838e+06 miss_ratio: 0.313123 max_rss_mb: 252.418/89MB 32thread gt_clock -> kops/s: 0.77 io_bytes/op: 3.99236e+06 miss_ratio: 0.236296 max_rss_mb: 396.422/89MB 32thread new_clock -> kops/s: 1064.97 io_bytes/op: 2687.23 miss_ratio: 0.0346134 max_rss_mb: 155.293//89MB 128thread base -> kops/s: 4.959 io_bytes/op: 6.20297e+06 miss_ratio: 0.323945 max_rss_mb: 823.43/89MB 128thread folly -> kops/s: 4.962 io_bytes/op: 5.9601e+06 miss_ratio: 0.319857 max_rss_mb: 626.824/89MB 128thread gt_clock -> kops/s: 1.009 io_bytes/op: 4.1083e+06 miss_ratio: 0.242512 max_rss_mb: 1095.32/89MB 128thread new_clock -> kops/s: 1224.39 io_bytes/op: 2688.2 miss_ratio: 0.0346207 max_rss_mb: 218.223//^ Now something interesting has happened: the new clock cache has gained a dramatic lead in the single-threaded case, and this is because the cache is so small, and full filters are so big, that dividing the cache into 64 shards leads to significant (random) imbalances in cache shards and excessive churn in imbalanced shards. This new clock cache only uses two shards for this configuration, and that helps to ensure that entries are part of a sufficiently big pool that their eviction order resembles the single-shard order. (This effect is not seen with partitioned index+filters.)//Even smaller cache size:/34MB 1thread base -> kops/s: 0.198 io_bytes/op: 1.65342e+07 miss_ratio: 0.939466 max_rss_mb: 48.6914/34MB 1thread folly -> kops/s: 0.201 io_bytes/op: 1.63416e+07 miss_ratio: 0.939081 max_rss_mb: 45.3281/34MB 1thread gt_clock -> kops/s: 0.448 io_bytes/op: 4.43957e+06 miss_ratio: 0.266749 max_rss_mb: 100.523/34MB 1thread new_clock -> kops/s: 1.055 io_bytes/op: 1.85439e+06 miss_ratio: 0.107512 max_rss_mb: 75.3125//34MB 32thread base -> kops/s: 3.346 io_bytes/op: 1.64852e+07 miss_ratio: 0.93596 max_rss_mb: 180.48/34MB 32thread folly -> kops/s: 3.431 io_bytes/op: 1.62857e+07 miss_ratio: 0.935693 max_rss_mb: 137.531/34MB 32thread gt_clock -> kops/s: 1.47 io_bytes/op: 4.89704e+06 miss_ratio: 0.295081 max_rss_mb: 392.465/34MB 32thread new_clock -> kops/s: 8.19 io_bytes/op: 3.70456e+06 miss_ratio: 0.20826 max_rss_mb: 519.793//34MB 128thread base -> kops/s: 2.293 io_bytes/op: 1.64351e+07 miss_ratio: 0.931866 max_rss_mb: 449.484/34MB 128thread folly -> kops/s: 2.34 io_bytes/op: 1.6219e+07 miss_ratio: 0.932023 max_rss_mb: 396.457/34MB 128thread gt_clock -> kops/s: 1.798 io_bytes/op: 5.4241e+06 miss_ratio: 0.324881 max_rss_mb: 1104.41/34MB 128thread new_clock -> kops/s: 10.519 io_bytes/op: 2.39354e+06 miss_ratio: 0.136147 max_rss_mb: 1050.52//As the miss ratio gets higher (say, above 10%), the CPU time spent in eviction starts to erode the advantage of using fewer shards (13% miss rate much lower than 94%). LRU's O(1) eviction time can eventually pay off when there's enough block cache churn://13MB 1thread base -> kops/s: 0.195 io_bytes/op: 1.65732e+07 miss_ratio: 0.946604 max_rss_mb: 45.6328/13MB 1thread folly -> kops/s: 0.197 io_bytes/op: 1.63793e+07 miss_ratio: 0.94661 max_rss_mb: 33.8633/13MB 1thread gt_clock -> kops/s: 0.519 io_bytes/op: 4.43316e+06 miss_ratio: 0.269379 max_rss_mb: 100.684/13MB 1thread new_clock -> kops/s: 0.176 io_bytes/op: 1.54148e+07 miss_ratio: 0.91545 max_rss_mb: 66.2383//13MB 32thread base -> kops/s: 3.266 io_bytes/op: 1.65544e+07 miss_ratio: 0.943386 max_rss_mb: 132.492/13MB 32thread folly -> kops/s: 3.396 io_bytes/op: 1.63142e+07 miss_ratio: 0.943243 max_rss_mb: 101.863/13MB 32thread gt_clock -> kops/s: 2.758 io_bytes/op: 5.13714e+06 miss_ratio: 0.310652 max_rss_mb: 396.121/13MB 32thread new_clock -> kops/s: 3.11 io_bytes/op: 1.23419e+07 miss_ratio: 0.708425 max_rss_mb: 321.758//13MB 128thread base -> kops/s: 2.31 io_bytes/op: 1.64823e+07 miss_ratio: 0.939543 max_rss_mb: 425.539/13MB 128thread folly -> kops/s: 2.339 io_bytes/op: 1.6242e+07 miss_ratio: 0.939966 max_rss_mb: 346.098/13MB 128thread gt_clock -> kops/s: 3.223 io_bytes/op: 5.76928e+06 miss_ratio: 0.345899 max_rss_mb: 1087.77/13MB 128thread new_clock -> kops/s: 2.984 io_bytes/op: 1.05341e+07 miss_ratio: 0.606198 max_rss_mb: 898.27//gt_clock is clearly blowing way past its memory budget for lower miss rates and best throughput. new_clock also seems to be exceeding budgets, and this warrants more investigation but is not the use case we are targeting with the new cache. With partitioned index+filter, the miss ratio is much better, and although still high enough that the eviction CPU time is definitely offsetting mutex contention://13MB 1thread base -> kops/s: 16.326 io_bytes/op: 23743.9 miss_ratio: 0.205362 max_rss_mb: 65.2852/13MB 1thread folly -> kops/s: 15.574 io_bytes/op: 19415 miss_ratio: 0.184157 max_rss_mb: 56.3516/13MB 1thread gt_clock -> kops/s: 14.459 io_bytes/op: 22873 miss_ratio: 0.198355 max_rss_mb: 63.9688/13MB 1thread new_clock -> kops/s: 16.34 io_bytes/op: 24386.5 miss_ratio: 0.210512 max_rss_mb: 61.707//13MB 128thread base -> kops/s: 289.786 io_bytes/op: 23710.9 miss_ratio: 0.205056 max_rss_mb: 103.57/13MB 128thread folly -> kops/s: 185.282 io_bytes/op: 19433.1 miss_ratio: 0.184275 max_rss_mb: 116.219/13MB 128thread gt_clock -> kops/s: 354.451 io_bytes/op: 23150.6 miss_ratio: 0.200495 max_rss_mb: 102.871/13MB 128thread new_clock -> kops/s: 295.359 io_bytes/op: 24626.4 miss_ratio: 0.212452 max_rss_mb: 121.109//Pull Request resolved: https://github.com/facebook/rocksdb/pull/10626//Test Plan: updated unit tests, stress/crash test runs including with TSAN, ASAN, UBSAN//Reviewed By: anand1976//Differential Revision: D39368406//Pulled By: pdillinger//fbshipit-source-id: 5afc44da4c656f8f751b44552bbf27bd3ca6fef9",https://github.com/facebook/rocksdb/commit/5724348689c7b6f51a3bbca5723af2185b77653e,6934395,facebook/rocksdb,False,False
